{"schema_version":1,"collected_at_unix_ms":1792680413970,"windows_version":"Microsoft Windows NT 10.0.26200.0","architecture":"AMD64","firmware":"uefi","secure_boot_enabled":true,"elevated":true,"firmware_environment_readable":true,"windows_servicing_idle":true,"system_drive":"C:","power":{"battery_present":false,"on_ac_power":null,"charge_percent":null},"disks":[{"number":0,"guid":"{79fe1fe7-1f4b-4350-8539-e61007af2d96}","partition_style":"GPT","size_bytes":137438953472,"logical_sector_bytes":512,"physical_sector_bytes":4096,"health_status":"Healthy","operational_status":["Online"],"partitions":[{"number":1,"guid":"{3ab4de3b-e240-40e9-bfa7-6c1ef27be2c3}","type_guid":"{c12a7328-f81f-11d2-ba4b-00a0c93ec93b}","offset_bytes":1048576,"size_bytes":536870912,"is_boot":false,"is_system":true,"drive_letter":null,"name":"System","volume":{"unique_id":"\\\\?\\Volume{3ab4de3b-e240-40e9-bfa7-6c1ef27be2c3}\\","filesystem":"FAT32","size_bytes":532676608,"size_remaining_bytes":497332224,"health_status":"Healthy"},"resize":null,"bitlocker":null},{"number":2,"guid":"{a337724d-6baa-4016-a0de-50796ab1aab7}","type_guid":"{e3c9e316-0b5c-4db8-817d-f92df00215ae}","offset_bytes":537919488,"size_bytes":16777216,"is_boot":false,"is_system":false,"drive_letter":null,"name":"Reserved","volume":null,"resize":null,"bitlocker":null},{"number":3,"guid":"{5a3a8a82-c1e4-42d6-bbfa-092b21396c65}","type_guid":"{ebd0a0a2-b9e5-4433-87c0-68b6b72699c7}","offset_bytes":554696704,"size_bytes":136111456256,"is_boot":true,"is_system":false,"drive_letter":"C","name":"Basic","volume":{"unique_id":"\\\\?\\Volume{5a3a8a82-c1e4-42d6-bbfa-092b21396c65}\\","filesystem":"NTFS","size_bytes":136111452160,"size_remaining_bytes":119657459712,"health_status":"Healthy"},"resize":{"minimum_bytes":22955675648,"maximum_bytes":136111456256},"bitlocker":{"protection_status":"Off","volume_status":"FullyDecrypted","recovery_password_protector_present":false}},{"number":4,"guid":"{a2b14175-f434-45fe-8b69-48a96f365643}","type_guid":"{de94bba4-06d1-4d40-a16a-bfd50179d6ac}","offset_bytes":136666152960,"size_bytes":770703360,"is_boot":false,"is_system":false,"drive_letter":null,"name":"Recovery","volume":{"unique_id":"\\\\?\\Volume{a2b14175-f434-45fe-8b69-48a96f365643}\\","filesystem":"NTFS","size_bytes":770699264,"size_remaining_bytes":120303616,"health_status":"Healthy"},"resize":null,"bitlocker":null}]},{"number":1,"guid":null,"partition_style":"MBR","size_bytes":67108864,"logical_sector_bytes":512,"physical_sector_bytes":512,"health_status":"Healthy","operational_status":["Online"],"partitions":[{"number":1,"guid":null,"type_guid":null,"offset_bytes":0,"size_bytes":67108864,"is_boot":false,"is_system":false,"drive_letter":"D","name":"FAT16","volume":null,"resize":null,"bitlocker":null}]}]}